{
  "compilationRunId": "26262626-2626-4262-8262-262626262626",
  "constructionDefinitionVersionId": "27272727-2727-4272-8272-272727272727",
  "corpusReleaseId": "22222222-2222-4222-8222-222222222222",
  "queryAstHash": "bbbbbbbbbbbbbbbbbbbbbbbbbbbbbbbbbbbbbbbbbbbbbbbbbbbbbbbbbbbbbbbb",
  "dependencyManifest": {
    "annotationLayerIds": [
      "66666666-6666-4666-8666-666666666666",
      "77777777-7777-4777-8777-777777777777",
      "88888888-8888-4888-8888-888888888888"
    ],
    "semanticSetVersionIds": [
      "99999999-9999-4999-8999-999999999999"
    ],
    "normalizationProfileIds": [
      "55555555-5555-4555-8555-555555555555"
    ],
    "relationTypes": [
      "PREFIX_MORPHEME_OF",
      "SAME_CLAUSE"
    ]
  },
  "compilerVersion": "fixture-query-compiler-1",
  "startedAt": "2026-10-03T00:00:00Z",
  "completedAt": "2026-10-03T00:00:01Z",
  "resultCount": 1,
  "resultSetHash": "cccccccccccccccccccccccccccccccccccccccccccccccccccccccccccccccc",
  "status": "COMPLETED"
}
